{
  "artifact_schema_version": "current_fact_row_move_cell_candidate_input/v1",
  "authority_boundary": {
    "official": "authority_candidate_only",
    "supercombo": "enrichment_or_cross_reference_only"
  },
  "candidate_boundary": {
    "blocked_records": "excluded_to_classifier_or_source_review",
    "legacy_raw_exports": "excluded_as_source_input",
    "local_source_payloads": "excluded_from_public_artifact",
    "lookup_ready_candidates": "parsed_value_only",
    "reviewer_observations": "observation_candidate_only_not_authority",
    "supercombo": "enrichment_or_cross_reference_only",
    "synthetic_fixtures": "not_source_truth"
  },
  "generated_from": [
    "contracts/current-facts/current_fact_row_move_cell_candidate_input.schema.json",
    "data/source-reviews/20260524-official-note-linkage-source-review-summary.json",
    "data/source-reviews/20260525-current-fact-row-move-cell-candidate-evidence.json",
    "data/value-shape-policies/20260521T025403Z-parsed-value-classifier-coverage.json",
    "docs/acquisition-reports/20260521T025403Z-current-source-acquisition.md",
    "docs/execplans/2026-05-25-current-fact-candidate-evidence-amendment.md",
    "docs/source-reviews/20260525-current-fact-row-move-cell-candidate-evidence.md"
  ],
  "records": [
    {
      "acquisition_report_refs": [
        "docs/acquisition-reports/20260521T025403Z-current-source-acquisition.md"
      ],
      "authority_status": "authority_candidate",
      "calculation_input_status": "parsed_range_not_single_value_calculation_safe",
      "candidate_record_id": "candidate:official:alex:row-41:cell-5:value-520f8306db0f",
      "character_slug": "alex",
      "coverage_refs": [
        "data/value-shape-policies/20260521T025403Z-parsed-value-classifier-coverage.json"
      ],
      "display_label_ja": "フライングクロスチョップ（ジャンプ中に） 強",
      "evidence": {
        "evidence_basis": "source_review_summary",
        "public_reference": "data/source-reviews/20260525-current-fact-row-move-cell-candidate-evidence.json",
        "run_id": "20260521T025403Z",
        "source_header_path": [
          "硬直差",
          "ガード"
        ],
        "source_label": "ガード",
        "source_name": "official",
        "source_role": "authority_candidate"
      },
      "field_key": "block_advantage",
      "move_id": "official:alex:row-41:move-f09489ff6eaa",
      "parsed_value": {
        "end": -1,
        "kind": "frame_range",
        "start": -12,
        "unit": "frame"
      },
      "parser_rule_ids": [
        "frame_range.official_signed_wave_dash.v1"
      ],
      "raw_value": "-12～-1",
      "raw_value_length": 6,
      "raw_value_sha256": "520f8306db0f00d860dfbf1f72aed57178586bbac1b4e2f2ceb6fa3c31284c35",
      "source_cell_key": "official:alex:table-0:row-41:cell-5",
      "source_cell_order": 5,
      "source_family": "advantage",
      "source_header_path": [
        "硬直差",
        "ガード"
      ],
      "source_label": "ガード",
      "source_name": "official",
      "source_review_refs": [
        "data/source-reviews/20260525-current-fact-row-move-cell-candidate-evidence.json",
        "docs/execplans/2026-05-23-official-signed-range-parser.md"
      ],
      "source_role": "authority_candidate",
      "source_row_key": "official:alex:table-0:row-41",
      "source_row_order": 41,
      "source_value_key": "official:alex:table-0:row-41:cell-5:value-520f8306db0f",
      "value_shape": {
        "classes": [
          "range"
        ],
        "classifier_status": "parsed",
        "parser_rule_id": "frame_range.official_signed_wave_dash.v1",
        "review_item_id": "value-shape:official--unclassified_expression--u_c135db53355f--u_522ba9f47afb"
      }
    },
    {
      "acquisition_report_refs": [
        "docs/acquisition-reports/20260521T025403Z-current-source-acquisition.md"
      ],
      "authority_status": "authority_candidate",
      "calculation_input_status": "parsed_range_not_single_value_calculation_safe",
      "candidate_record_id": "candidate:official:cammy:row-52:cell-5:value-f3bd1df4c26d",
      "character_slug": "cammy",
      "coverage_refs": [
        "data/value-shape-policies/20260521T025403Z-parsed-value-classifier-coverage.json"
      ],
      "display_label_ja": "リバースエッジ（フーリガンコンビネーション中に）",
      "evidence": {
        "evidence_basis": "source_review_summary",
        "public_reference": "data/source-reviews/20260525-current-fact-row-move-cell-candidate-evidence.json",
        "run_id": "20260521T025403Z",
        "source_header_path": [
          "硬直差",
          "ガード"
        ],
        "source_label": "ガード",
        "source_name": "official",
        "source_role": "authority_candidate"
      },
      "field_key": "block_advantage",
      "move_id": "official:cammy:row-52:move-003104ea0ff9",
      "parsed_value": {
        "end": -1,
        "kind": "frame_range",
        "start": -4,
        "unit": "frame"
      },
      "parser_rule_ids": [
        "frame_range.official_signed_wave_dash.v1"
      ],
      "raw_value": "-4～-1",
      "raw_value_length": 5,
      "raw_value_sha256": "f3bd1df4c26d078a592238ff898964a14b5859e74fe097da1bfae2a76be7c5a7",
      "source_cell_key": "official:cammy:table-0:row-52:cell-5",
      "source_cell_order": 5,
      "source_family": "advantage",
      "source_header_path": [
        "硬直差",
        "ガード"
      ],
      "source_label": "ガード",
      "source_name": "official",
      "source_review_refs": [
        "data/source-reviews/20260525-current-fact-row-move-cell-candidate-evidence.json",
        "docs/execplans/2026-05-23-official-signed-range-parser.md"
      ],
      "source_role": "authority_candidate",
      "source_row_key": "official:cammy:table-0:row-52",
      "source_row_order": 52,
      "source_value_key": "official:cammy:table-0:row-52:cell-5:value-f3bd1df4c26d",
      "value_shape": {
        "classes": [
          "range"
        ],
        "classifier_status": "parsed",
        "parser_rule_id": "frame_range.official_signed_wave_dash.v1",
        "review_item_id": "value-shape:official--unclassified_expression--u_c135db53355f--u_522ba9f47afb"
      }
    },
    {
      "acquisition_report_refs": [
        "docs/acquisition-reports/20260521T025403Z-current-source-acquisition.md"
      ],
      "authority_status": "authority_candidate",
      "calculation_input_status": "annotated_candidate_not_calculation_safe",
      "candidate_record_id": "candidate:official:chunli:row-32:cell-4:value-38098349c914",
      "character_slug": "chunli",
      "coverage_refs": [
        "data/value-shape-policies/20260521T025403Z-parsed-value-classifier-coverage.json"
      ],
      "display_label_ja": "蘭華（行雲流水中に）弱",
      "evidence": {
        "evidence_basis": "source_review_summary",
        "public_reference": "data/source-reviews/20260525-current-fact-row-move-cell-candidate-evidence.json",
        "run_id": "20260521T025403Z",
        "source_header_path": [
          "硬直差",
          "ヒット"
        ],
        "source_label": "ヒット",
        "source_name": "official",
        "source_role": "authority_candidate"
      },
      "field_key": "hit_advantage",
      "move_id": "official:chunli:row-32:move-278b4bdd0acb",
      "parsed_value": {
        "annotation": {
          "marker_placement": "prefix",
          "note_id": null,
          "note_linkage_status": "same_row_note_candidates_available",
          "note_marker": "※",
          "note_scope": "row_hit_advantage_condition",
          "note_text_status": "structured_row_note_text_found",
          "row_note_candidate_count": 1
        },
        "calculation": {
          "calculation_input_status": "annotated_candidate_not_calculation_safe",
          "reason": "condition_bound_by_official_note"
        },
        "kind": "annotated_numeric_candidate",
        "numeric_candidate": {
          "candidate_type": "signed_frame",
          "unit": "frame",
          "value": -3
        },
        "source_context": {
          "review_item_id": "value-shape:official--source_specific_expression--u_c135db53355f--u_7acd6c7b6e69",
          "source_column_header_path": [
            "硬直差",
            "ヒット"
          ],
          "source_review_id": "source-review:official-note-linkage-hit-advantage"
        }
      },
      "parser_rule_ids": [
        "annotated_signed_frame.official_prefix_marker.negative.v1"
      ],
      "raw_value": "※-3",
      "raw_value_length": 3,
      "raw_value_sha256": "38098349c914433f0d197b466d52fc182309a3043e91d401f8c2a98b3b8917ca",
      "source_cell_key": "official:chunli:table-0:row-32:cell-4",
      "source_cell_order": 4,
      "source_family": "advantage",
      "source_header_path": [
        "硬直差",
        "ヒット"
      ],
      "source_label": "ヒット",
      "source_name": "official",
      "source_review_refs": [
        "data/source-reviews/20260524-official-note-linkage-source-review-summary.json",
        "data/source-reviews/20260525-current-fact-row-move-cell-candidate-evidence.json"
      ],
      "source_role": "authority_candidate",
      "source_row_key": "official:chunli:table-0:row-32",
      "source_row_order": 32,
      "source_value_key": "official:chunli:table-0:row-32:cell-4:value-38098349c914",
      "value_shape": {
        "classes": [
          "note_prefixed"
        ],
        "classifier_status": "parsed",
        "parser_rule_id": "annotated_signed_frame.official_prefix_marker.negative.v1",
        "review_item_id": "value-shape:official--source_specific_expression--u_c135db53355f--u_7acd6c7b6e69"
      }
    },
    {
      "acquisition_report_refs": [
        "docs/acquisition-reports/20260521T025403Z-current-source-acquisition.md"
      ],
      "authority_status": "authority_candidate",
      "calculation_input_status": "annotated_candidate_not_calculation_safe",
      "candidate_record_id": "candidate:official:chunli:row-32:cell-5:value-b5112d05eab3",
      "character_slug": "chunli",
      "coverage_refs": [